{
  "$schema": "../trace-bundle.schema.json",
  "schemaVersion": "1.0.0",
  "runId": "canonical-verdant-signal-first",
  "worldId": "verdant-signal-garden",
  "missionId": "signal-vs-timeout",
  "scenarioId": "signal-at-29s",
  "flowerVersion": "0.1.1",
  "flowDefinitionVersion": "verdant-signal-v1",
  "projectionVersion": "verdant-signal-projection-v1",
  "events": [
    {
      "schemaVersion": "1.0.0",
      "eventId": "canonical-verdant-signal-first:000001",
      "runId": "canonical-verdant-signal-first",
      "sequence": 1,
      "logicalTimeMillis": 0,
      "source": "RUN_COORDINATOR",
      "kind": "GARDEN.RUN_CREATED",
      "flow": null,
      "payload": {
        "checkPrecedence": "SIGNAL_THEN_TIMEOUT",
        "clock": "ManualClock",
        "driveMode": "MANUAL",
        "engineLifecycle": "ATTACHED",
        "timeoutMillis": 30000,
        "workerName": "verdant-interactive-worker"
      },
      "evidence": []
    },
    {
      "schemaVersion": "1.0.0",
      "eventId": "canonical-verdant-signal-first:000002",
      "runId": "canonical-verdant-signal-first",
      "sequence": 2,
      "logicalTimeMillis": 0,
      "source": "RUN_COORDINATOR",
      "kind": "GARDEN.FLOW_READY",
      "flow": {
        "type": "signal-vs-timeout",
        "key": "canonical-verdant-signal-first",
        "state": "READY",
        "stepId": null,
        "stepNo": 0
      },
      "payload": {
        "initialStepId": "wait-for-yard-assignment",
        "workerName": "verdant-interactive-worker"
      },
      "evidence": []
    },
    {
      "schemaVersion": "1.0.0",
      "eventId": "canonical-verdant-signal-first:000003",
      "runId": "canonical-verdant-signal-first",
      "sequence": 3,
      "logicalTimeMillis": 0,
      "source": "RUN_COORDINATOR",
      "kind": "GARDEN.TICK_REQUESTED",
      "flow": {
        "type": "signal-vs-timeout",
        "key": "canonical-verdant-signal-first",
        "state": "READY",
        "stepId": null,
        "stepNo": 0
      },
      "payload": {
        "commandId": "tick-init",
        "expectedSequence": 2,
        "kind": "TICK",
        "phase": "READY",
        "workerTicks": 0
      },
      "evidence": []
    },
    {
      "schemaVersion": "1.0.0",
      "eventId": "canonical-verdant-signal-first:000004",
      "runId": "canonical-verdant-signal-first",
      "sequence": 4,
      "logicalTimeMillis": 0,
      "source": "FLOWER_LISTENER",
      "kind": "FLOWER.FLOW_SUBMITTED",
      "flow": {
        "type": "signal-vs-timeout",
        "key": "canonical-verdant-signal-first",
        "state": "READY",
        "stepId": null,
        "stepNo": 0
      },
      "payload": {},
      "evidence": []
    },
    {
      "schemaVersion": "1.0.0",
      "eventId": "canonical-verdant-signal-first:000005",
      "runId": "canonical-verdant-signal-first",
      "sequence": 5,
      "logicalTimeMillis": 0,
      "source": "FLOWER_STEP",
      "kind": "VERDANT.WAIT_STARTED",
      "flow": {
        "type": "signal-vs-timeout",
        "key": "canonical-verdant-signal-first",
        "state": "RUNNING",
        "stepId": "wait-for-yard-assignment",
        "stepNo": 0
      },
      "payload": {
        "checkPrecedence": "SIGNAL_THEN_TIMEOUT",
        "deadlineMillis": 30000,
        "signalName": "yard-assignment",
        "startedAtMillis": 0,
        "timeoutMillis": 30000
      },
      "evidence": [
        {
          "type": "SOURCE",
          "ref": "VerdantFlowFactory.WaitForYardAssignmentStep.onTick",
          "label": "The Step checks hasSignal before timedOut and returns the recorded StepResult."
        },
        {
          "type": "TEST",
          "ref": "VerdantRunCoordinatorTest.sameTickUsesExplicitSignalFirstStepPolicyRegardlessOfInputCommandOrder",
          "label": "Both predicates are true on the same deterministic Worker tick."
        }
      ]
    },
    {
      "schemaVersion": "1.0.0",
      "eventId": "canonical-verdant-signal-first:000006",
      "runId": "canonical-verdant-signal-first",
      "sequence": 6,
      "logicalTimeMillis": 0,
      "source": "FLOWER_LISTENER",
      "kind": "FLOWER.STEP_ENTERED",
      "flow": {
        "type": "signal-vs-timeout",
        "key": "canonical-verdant-signal-first",
        "state": "RUNNING",
        "stepId": "wait-for-yard-assignment",
        "stepNo": 0
      },
      "payload": {},
      "evidence": []
    },
    {
      "schemaVersion": "1.0.0",
      "eventId": "canonical-verdant-signal-first:000007",
      "runId": "canonical-verdant-signal-first",
      "sequence": 7,
      "logicalTimeMillis": 0,
      "source": "FLOWER_STEP",
      "kind": "VERDANT.WAIT_EVALUATED",
      "flow": {
        "type": "signal-vs-timeout",
        "key": "canonical-verdant-signal-first",
        "state": "RUNNING",
        "stepId": "wait-for-yard-assignment",
        "stepNo": 0
      },
      "payload": {
        "checkPrecedence": "SIGNAL_THEN_TIMEOUT",
        "elapsedMillis": 0,
        "returnedStepResult": "STAY",
        "selectedPath": "WAITING",
        "signalPresent": false,
        "stepTick": 1,
        "timedOut": false,
        "winner": "NONE"
      },
      "evidence": [
        {
          "type": "SOURCE",
          "ref": "VerdantFlowFactory.WaitForYardAssignmentStep.onTick",
          "label": "The Step checks hasSignal before timedOut and returns the recorded StepResult."
        },
        {
          "type": "TEST",
          "ref": "VerdantRunCoordinatorTest.sameTickUsesExplicitSignalFirstStepPolicyRegardlessOfInputCommandOrder",
          "label": "Both predicates are true on the same deterministic Worker tick."
        }
      ]
    },
    {
      "schemaVersion": "1.0.0",
      "eventId": "canonical-verdant-signal-first:000008",
      "runId": "canonical-verdant-signal-first",
      "sequence": 8,
      "logicalTimeMillis": 0,
      "source": "FLOWER_STEP",
      "kind": "FLOWER.STEP_RESULT",
      "flow": {
        "type": "signal-vs-timeout",
        "key": "canonical-verdant-signal-first",
        "state": "RUNNING",
        "stepId": "wait-for-yard-assignment",
        "stepNo": 0
      },
      "payload": {
        "observations": {
          "checkPrecedence": "SIGNAL_THEN_TIMEOUT",
          "elapsedMillis": 0,
          "returnedStepResult": "STAY",
          "selectedPath": "WAITING",
          "signalPresent": false,
          "stepTick": 1,
          "timedOut": false,
          "winner": "NONE"
        },
        "result": "STAY",
        "stepNo": 0,
        "stepTick": 1
      },
      "evidence": [
        {
          "type": "SOURCE",
          "ref": "flower-core:Flow.applyResult",
          "label": "Flower applies this actual StepResult to select the next Step or finish."
        },
        {
          "type": "TEST",
          "ref": "VerdantRunCoordinatorTest.sameTickUsesExplicitSignalFirstStepPolicyRegardlessOfInputCommandOrder",
          "label": "The deterministic both-true test verifies the mission Step's policy."
        }
      ]
    },
    {
      "schemaVersion": "1.0.0",
      "eventId": "canonical-verdant-signal-first:000009",
      "runId": "canonical-verdant-signal-first",
      "sequence": 9,
      "logicalTimeMillis": 0,
      "source": "RUN_COORDINATOR",
      "kind": "GARDEN.TICK_COMPLETED",
      "flow": {
        "type": "signal-vs-timeout",
        "key": "canonical-verdant-signal-first",
        "state": "RUNNING",
        "stepId": "wait-for-yard-assignment",
        "stepNo": 0
      },
      "payload": {
        "afterPhase": "RUNNING",
        "afterStepId": "wait-for-yard-assignment",
        "beforePhase": "READY",
        "beforeStepId": null,
        "commandId": "tick-init",
        "workerTick": 1
      },
      "evidence": []
    },
    {
      "schemaVersion": "1.0.0",
      "eventId": "canonical-verdant-signal-first:000010",
      "runId": "canonical-verdant-signal-first",
      "sequence": 10,
      "logicalTimeMillis": 0,
      "source": "RUN_COORDINATOR",
      "kind": "GARDEN.TIME_ADVANCE_REQUESTED",
      "flow": {
        "type": "signal-vs-timeout",
        "key": "canonical-verdant-signal-first",
        "state": "RUNNING",
        "stepId": "wait-for-yard-assignment",
        "stepNo": 0
      },
      "payload": {
        "beforeMillis": 0,
        "commandId": "advance-29s",
        "expectedSequence": 9,
        "kind": "ADVANCE_TIME",
        "millis": 29000,
        "phase": "RUNNING",
        "workerTicks": 1
      },
      "evidence": []
    },
    {
      "schemaVersion": "1.0.0",
      "eventId": "canonical-verdant-signal-first:000011",
      "runId": "canonical-verdant-signal-first",
      "sequence": 11,
      "logicalTimeMillis": 29000,
      "source": "RUN_COORDINATOR",
      "kind": "GARDEN.TIME_ADVANCED",
      "flow": {
        "type": "signal-vs-timeout",
        "key": "canonical-verdant-signal-first",
        "state": "RUNNING",
        "stepId": "wait-for-yard-assignment",
        "stepNo": 0
      },
      "payload": {
        "afterMillis": 29000,
        "beforeMillis": 0,
        "commandId": "advance-29s",
        "deadlineMillis": 30000,
        "deadlineReached": false,
        "millis": 29000
      },
      "evidence": []
    },
    {
      "schemaVersion": "1.0.0",
      "eventId": "canonical-verdant-signal-first:000012",
      "runId": "canonical-verdant-signal-first",
      "sequence": 12,
      "logicalTimeMillis": 29000,
      "source": "RUN_COORDINATOR",
      "kind": "GARDEN.SIGNAL_SEND_REQUESTED",
      "flow": {
        "type": "signal-vs-timeout",
        "key": "canonical-verdant-signal-first",
        "state": "RUNNING",
        "stepId": "wait-for-yard-assignment",
        "stepNo": 0
      },
      "payload": {
        "commandId": "signal-at-29s",
        "expectedSequence": 11,
        "kind": "SEND_SIGNAL",
        "name": "yard-assignment",
        "phase": "RUNNING",
        "waitStepActive": true,
        "workerTicks": 1
      },
      "evidence": []
    },
    {